bn_sentence,bn_voice,en_sentence,en_voice,gu_sentence,gu_voice,hi_sentence,hi_voice,kn_sentence,kn_voice,ml_sentence,ml_voice,mr_sentence,mr_voice,ta_sentence,ta_voice,te_sentence,te_voice,ur_sentence,ur_voice,as_sentence,as_voice,or_sentence,or_voice
অংশীদার হস্তক্ষেপ সম্পূর্ণ। Nder ণদানকারী হস্তক্ষেপের অপেক্ষায়।,../data/bn/bn_voicedata/75.mp3,Partner intervention completed. Awaiting lender intervention.,../data/en/en_voicedata/75.mp3,ભાગીદાર હસ્તક્ષેપ પૂર્ણ. Nder ણદાતા હસ્તક્ષેપની રાહ જોવી.,../data/gu/gu_voicedata/75.mp3,पार्टनर हस्तक्षेप पूरा हुआ। ऋणदाता हस्तक्षेप का इंतजार।,../data/hi/hi_voicedata/75.mp3,ಪಾಲುದಾರ ಹಸ್ತಕ್ಷೇಪ ಪೂರ್ಣಗೊಂಡಿದೆ. ಸಾಲದಾತ ಹಸ್ತಕ್ಷೇಪಕ್ಕಾಗಿ ಕಾಯುತ್ತಿದೆ.,../data/kn/kn_voicedata/75.mp3,പങ്കാളി ഇടപെടൽ പൂർത്തിയായി. വായ്പ നൽകുന്ന ഇടപെടൽക്കായി കാത്തിരിക്കുന്നു.,../data/ml/ml_voicedata/75.mp3,भागीदार हस्तक्षेप पूर्ण झाला. सावकार हस्तक्षेपाची वाट पहात आहे.,../data/mr/mr_voicedata/75.mp3,கூட்டாளர் தலையீடு முடிந்தது. கடன் வழங்குநர் தலையீட்டிற்காக காத்திருக்கிறது.,../data/ta/ta_voicedata/75.mp3,భాగస్వామి జోక్యం పూర్తయింది. రుణదాత జోక్యం కోసం వేచి ఉంది.,../data/te/te_voicedata/75.mp3,پارٹنر مداخلت مکمل ہوگئی۔ قرض دینے والے مداخلت کا انتظار کر رہا ہے۔,../data/ur/ur_voicedata/75.mp3,অংশীদাৰৰ হস্তক্ষেপ সম্পূৰ্ণ কৰা হৈছে। ঋণদাতাৰ হস্তক্ষেপৰ বাবে অপেক্ষা কৰি আছে।,../data/as/as_voicedata/75.mp3,ସହଭାଗୀ ହସ୍ତକ୍ଷେପ ସମାପ୍ତ ହୋଇଛି | Ender ଣଦାତା ହସ୍ତକ୍ଷେପକୁ ଅପେକ୍ଷା କରିଛି |,../data/or/or_voicedata/75.mp3
Nder ণদানকারী হস্তক্ষেপ সম্পূর্ণ। উদ্বৃত্ত ay ণ পরিশোধ পরবর্তী।,../data/bn/bn_voicedata/76.mp3,Lender intervention completed. Surplus repayment next.,../data/en/en_voicedata/76.mp3,[Translation error: Lender intervention completed. Surplus repayment next. --> No translation was found using the current translator. Try another translator?],../data/gu/gu_voicedata/76.mp3,ऋणदाता हस्तक्षेप पूरा हुआ। अधिशेष पुनर्भुगतान अगले।,../data/hi/hi_voicedata/76.mp3,ಸಾಲದಾತ ಹಸ್ತಕ್ಷೇಪ ಪೂರ್ಣಗೊಂಡಿದೆ. ಹೆಚ್ಚುವರಿ ಮರುಪಾವತಿ ಮುಂದಿನ.,../data/kn/kn_voicedata/76.mp3,വായ്പ നൽകുന്ന ഇടപെടൽ പൂർത്തിയായി. മിച്ച തിരിച്ചടവ് അടുത്തത്.,../data/ml/ml_voicedata/76.mp3,सावकार हस्तक्षेप पूर्ण झाला. अधिशेष परतफेड पुढील.,../data/mr/mr_voicedata/76.mp3,கடன் வழங்குநர் தலையீடு முடிந்தது. அடுத்து உபரி திருப்பிச் செலுத்துதல்.,../data/ta/ta_voicedata/76.mp3,రుణదాత జోక్యం పూర్తయింది. మిగులు తిరిగి చెల్లించడం.,../data/te/te_voicedata/76.mp3,قرض دہندہ کی مداخلت مکمل ہوگئی۔ اضافی ادائیگی اگلا۔,../data/ur/ur_voicedata/76.mp3,ঋণদাতাৰ হস্তক্ষেপ সম্পূৰ্ণ কৰা হৈছে। ইয়াৰ পিছত উদ্বৃত্ত পৰিশোধ।,../data/as/as_voicedata/76.mp3,Ender ଣଦାତା ହସ୍ତକ୍ଷେପ ସମାପ୍ତ | ପରବର୍ତ୍ତୀ ସମୟରେ ସରପ୍ଲସ୍ ପରିଶୋଧ |,../data/or/or_voicedata/76.mp3
উদ্বৃত্ত এক ay ণ পরিশোধ। চালিয়ে যাও!,../data/bn/bn_voicedata/77.mp3,Surplus one repayment made. Keep going!,../data/en/en_voicedata/77.mp3,સરપ્લસ એક ચુકવણી. ચાલુ રાખો!,../data/gu/gu_voicedata/77.mp3,अधिशेष एक पुनर्भुगतान किया गया। जाता रहना!,../data/hi/hi_voicedata/77.mp3,ಹೆಚ್ಚುವರಿ ಮರುಪಾವತಿ ಮಾಡಲಾಗಿದೆ. ಮುಂದುವರಿಯಿರಿ!,../data/kn/kn_voicedata/77.mp3,ഒരു തിരിച്ചടവ് മിച്ചം. പൊയ്ക്കൊണ്ടേയിരിക്കുന്നു!,../data/ml/ml_voicedata/77.mp3,अतिरिक्त एक परतफेड केली. चालू ठेवा!,../data/mr/mr_voicedata/77.mp3,உபரி ஒரு திருப்பிச் செலுத்துதல். தொடர்ந்து செல்லுங்கள்!,../data/ta/ta_voicedata/77.mp3,మిగులు ఒక తిరిగి చెల్లించడం. కొనసాగించండి!,../data/te/te_voicedata/77.mp3,سرپلس ایک ادائیگی کی گئی۔ چلتے رہیں!,../data/ur/ur_voicedata/77.mp3,উদ্বৃত্ত এটা পৰিশোধ কৰা হয়। চলি থাকিব!,../data/as/as_voicedata/77.mp3,ସରପଲସ୍ ଗୋଟିଏ ପରିଶୋଧ ତିଆରି | ଜାରି ରଖ!,../data/or/or_voicedata/77.mp3
উদ্বৃত্ত দুটি ay ণ পরিশোধ। দুর্দান্ত অগ্রগতি!,../data/bn/bn_voicedata/78.mp3,Surplus two repayments made. Excellent progress!,../data/en/en_voicedata/78.mp3,સરપ્લસ બે ચુકવણીઓ. ઉત્તમ પ્રગતિ!,../data/gu/gu_voicedata/78.mp3,अधिशेष दो पुनर्भुगतान किए गए। उत्कृष्ट प्रगति!,../data/hi/hi_voicedata/78.mp3,ಹೆಚ್ಚುವರಿ ಎರಡು ಮರುಪಾವತಿಗಳನ್ನು ಮಾಡಲಾಗಿದೆ. ಅತ್ಯುತ್ತಮ ಪ್ರಗತಿ!,../data/kn/kn_voicedata/78.mp3,മിച്ചം രണ്ട് തിരിച്ചടവ് നൽകി. മികച്ച പുരോഗതി!,../data/ml/ml_voicedata/78.mp3,अधिशेष दोन परतफेड केली. उत्कृष्ट प्रगती!,../data/mr/mr_voicedata/78.mp3,உபரி இரண்டு திருப்பிச் செலுத்துதல். சிறந்த முன்னேற்றம்!,../data/ta/ta_voicedata/78.mp3,మిగులు రెండు తిరిగి చెల్లించారు. అద్భుతమైన పురోగతి!,../data/te/te_voicedata/78.mp3,سرپلس دو ادائیگی کی گئی۔ عمدہ پیشرفت!,../data/ur/ur_voicedata/78.mp3,উদ্বৃত্ত দুটা পৰিশোধ কৰা হয়। চমৎকাৰ অগ্ৰগতি!,../data/as/as_voicedata/78.mp3,ଅତିରିକ୍ତ ଦୁଇଟି ପରିଶୋଧ କରାଯାଇଛି | ଉତ୍କୃଷ୍ଟ ଅଗ୍ରଗତି!,../data/or/or_voicedata/78.mp3
উদ্বৃত্ত তিনটি ay ণ পরিশোধ। অসামান্য!,../data/bn/bn_voicedata/79.mp3,Surplus three repayments made. Outstanding!,../data/en/en_voicedata/79.mp3,સરપ્લસ ત્રણ ચુકવણીઓ. બાકી!,../data/gu/gu_voicedata/79.mp3,अधिशेष तीन पुनर्भुगतान किए गए। असाधारण!,../data/hi/hi_voicedata/79.mp3,ಹೆಚ್ಚುವರಿ ಮೂರು ಮರುಪಾವತಿಗಳನ್ನು ಮಾಡಲಾಗಿದೆ. ಅತ್ಯುತ್ತಮ!,../data/kn/kn_voicedata/79.mp3,മിച്ചം മൂന്ന് തിരിച്ചടവ് നൽകി. കുടിശ്ശിക!,../data/ml/ml_voicedata/79.mp3,अतिरिक्त तीन परतफेड केली. थकबाकी!,../data/mr/mr_voicedata/79.mp3,உபரி மூன்று திருப்பிச் செலுத்துதல். நிலுவையில் உள்ளது!,../data/ta/ta_voicedata/79.mp3,మిగులు మూడు తిరిగి చెల్లించారు. అత్యుత్తమమైనది!,../data/te/te_voicedata/79.mp3,سرپلس تین ادائیگی کی گئی۔ بقایا!,../data/ur/ur_voicedata/79.mp3,উদ্বৃত্ত তিনিটা পৰিশোধ কৰা হৈছে। বাকী থকা!,../data/as/as_voicedata/79.mp3,ଅତିରିକ୍ତ ତିନୋଟି ପରିଶୋଧ କରାଯାଇଛି | ଉଲ୍ଲେଖନୀୟ!,../data/or/or_voicedata/79.mp3
উদ্বৃত্ত তিনটি প্লাস পরিশোধ করা হয়েছে। আপনি এগিয়ে!,../data/bn/bn_voicedata/80.mp3,Surplus three plus repayments made. You are ahead!,../data/en/en_voicedata/80.mp3,[Translation error: Surplus three plus repayments made. You are ahead! --> No translation was found using the current translator. Try another translator?],../data/gu/gu_voicedata/80.mp3,अधिशेष तीन प्लस चुकौती। आप आगे हैं!,../data/hi/hi_voicedata/80.mp3,ಹೆಚ್ಚುವರಿ ಮೂರು ಪ್ಲಸ್ ಮರುಪಾವತಿಗಳನ್ನು ಮಾಡಲಾಗಿದೆ. ನೀವು ಮುಂದಿದ್ದೀರಿ!,../data/kn/kn_voicedata/80.mp3,മിച്ചം മൂന്ന് പ്ലസ് തിരിച്ചടവ് നൽകി. നിങ്ങൾ മുന്നോട്ട് പോകുന്നു!,../data/ml/ml_voicedata/80.mp3,अतिरिक्त तीन अधिक परतफेड केली. आपण पुढे आहात!,../data/mr/mr_voicedata/80.mp3,உபரி மூன்று பிளஸ் திருப்பிச் செலுத்துதல். நீங்கள் முன்னால் இருக்கிறீர்கள்!,../data/ta/ta_voicedata/80.mp3,మిగులు మూడు ప్లస్ తిరిగి చెల్లించారు. మీరు ముందుకు ఉన్నారు!,../data/te/te_voicedata/80.mp3,سرپلس تین پلس ادائیگی کی گئی۔ آپ آگے ہیں!,../data/ur/ur_voicedata/80.mp3,উদ্বৃত্ত তিনিটা প্লাছ পৰিশোধ কৰা হৈছে। আপুনি আগবাঢ়ি আছা!,../data/as/as_voicedata/80.mp3,ଅତିରିକ୍ତ ତିନୋଟି ପ୍ଲସ୍ ପରିଶୋଧ କରାଯାଇଛି | ତୁମେ ଆଗାମୀ!,../data/or/or_voicedata/80.mp3
Loan ণের স্থিতি: যে কোনও। আপডেটের জন্য আপনার ড্যাশবোর্ডটি পরীক্ষা করুন।,../data/bn/bn_voicedata/81.mp3,Loan status: Any. Please check your dashboard for updates.,../data/en/en_voicedata/81.mp3,લોન સ્થિતિ: કોઈપણ. કૃપા કરીને અપડેટ્સ માટે તમારું ડેશબોર્ડ તપાસો.,../data/gu/gu_voicedata/81.mp3,ऋण की स्थिति: कोई भी। कृपया अपडेट के लिए अपने डैशबोर्ड की जाँच करें।,../data/hi/hi_voicedata/81.mp3,ಸಾಲದ ಸ್ಥಿತಿ: ಯಾವುದಾದರೂ. ನವೀಕರಣಗಳಿಗಾಗಿ ದಯವಿಟ್ಟು ನಿಮ್ಮ ಡ್ಯಾಶ್‌ಬೋರ್ಡ್ ಪರಿಶೀಲಿಸಿ.,../data/kn/kn_voicedata/81.mp3,വായ്പ നില: ഏതെങ്കിലും. അപ്ഡേറ്റുകൾക്കായി ദയവായി നിങ്ങളുടെ ഡാഷ്ബോർഡ് പരിശോധിക്കുക.,../data/ml/ml_voicedata/81.mp3,कर्जाची स्थिती: कोणतीही. कृपया अद्यतनांसाठी आपला डॅशबोर्ड तपासा.,../data/mr/mr_voicedata/81.mp3,கடன் நிலை: ஏதேனும். புதுப்பிப்புகளுக்கு உங்கள் டாஷ்போர்டை சரிபார்க்கவும்.,../data/ta/ta_voicedata/81.mp3,రుణ స్థితి: ఏదైనా. దయచేసి నవీకరణల కోసం మీ డాష్‌బోర్డ్‌ను తనిఖీ చేయండి.,../data/te/te_voicedata/81.mp3,قرض کی حیثیت: کوئی بھی۔ براہ کرم اپ ڈیٹس کے لئے اپنے ڈیش بورڈ کو چیک کریں۔,../data/ur/ur_voicedata/81.mp3,ঋণৰ অৱস্থা: যিকোনো। আপডেটৰ বাবে অনুগ্ৰহ কৰি আপোনাৰ ডেচব'ৰ্ড পৰীক্ষা কৰক।,../data/as/as_voicedata/81.mp3,Loan ଣ ସ୍ଥିତି: ଯେକ any ଣସି | ଅଦ୍ୟତନ ପାଇଁ ଦୟାକରି ଆପଣଙ୍କର ଡ୍ୟାସବୋର୍ଡ ଯାଞ୍ଚ କରନ୍ତୁ |,../data/or/or_voicedata/81.mp3
Loan ণ বন্ধ। বিশদ জন্য সমর্থনের সাথে যোগাযোগ করুন।,../data/bn/bn_voicedata/82.mp3,Loan written off. Please contact support for details.,../data/en/en_voicedata/82.mp3,લોન બંધ. વિગતો માટે સપોર્ટનો સંપર્ક કરો.,../data/gu/gu_voicedata/82.mp3,ऋण बंद है। कृपया विवरण के लिए समर्थन से संपर्क करें।,../data/hi/hi_voicedata/82.mp3,ಸಾಲವನ್ನು ಬರೆಯಲಾಗಿದೆ. ವಿವರಗಳಿಗಾಗಿ ದಯವಿಟ್ಟು ಬೆಂಬಲವನ್ನು ಸಂಪರ್ಕಿಸಿ.,../data/kn/kn_voicedata/82.mp3,ലോൺ എഴുതി. വിശദാംശങ്ങൾക്ക് ദയവായി പിന്തുണയുമായി ബന്ധപ്പെടുക.,../data/ml/ml_voicedata/82.mp3,कर्ज बंद. कृपया तपशीलांसाठी समर्थनाशी संपर्क साधा.,../data/mr/mr_voicedata/82.mp3,கடன் எழுதப்பட்டது. விவரங்களுக்கு ஆதரவைத் தொடர்பு கொள்ளவும்.,../data/ta/ta_voicedata/82.mp3,రుణం వ్రాసింది. దయచేసి వివరాల కోసం మద్దతును సంప్రదించండి.,../data/te/te_voicedata/82.mp3,قرض لکھا ہوا۔ براہ کرم تفصیلات کے لئے سپورٹ سے رابطہ کریں۔,../data/ur/ur_voicedata/82.mp3,ঋণৰ লিখিত বন্ধ। সবিশেষ জানিবলৈ অনুগ্ৰহ কৰি সমৰ্থনৰ সৈতে যোগাযোগ কৰক।,../data/as/as_voicedata/82.mp3,Loan ଣ ଲେଖା ହୋଇଛି | ବିବରଣୀ ପାଇଁ ଦୟାକରି ସମର୍ଥନ ଯୋଗାଯୋଗ କରନ୍ତୁ |,../data/or/or_voicedata/82.mp3
Loan ণ পরিশোধ। আপনার সময়োপযোগী অর্থ প্রদানের জন্য আপনাকে ধন্যবাদ।,../data/bn/bn_voicedata/83.mp3,Loan repaid. Thank you for your timely payments.,../data/en/en_voicedata/83.mp3,લોન ચૂકવવામાં આવે છે. તમારી સમયસર ચુકવણી બદલ આભાર.,../data/gu/gu_voicedata/83.mp3,ऋण चुकाया। आपके समय पर भुगतान के लिए धन्यवाद।,../data/hi/hi_voicedata/83.mp3,ಸಾಲ ಮರುಪಾವತಿ. ನಿಮ್ಮ ಸಮಯೋಚಿತ ಪಾವತಿಗಳಿಗೆ ಧನ್ಯವಾದಗಳು.,../data/kn/kn_voicedata/83.mp3,വായ്പ തിരിച്ചടച്ച. നിങ്ങളുടെ സമയബന്ധിതമായി നന്ദി.,../data/ml/ml_voicedata/83.mp3,कर्जाची परतफेड. आपल्या वेळेवर देयके दिल्याबद्दल धन्यवाद.,../data/mr/mr_voicedata/83.mp3,கடன் திருப்பிச் செலுத்தப்பட்டது. உங்கள் சரியான நேரத்தில் கொடுப்பனவுகளுக்கு நன்றி.,../data/ta/ta_voicedata/83.mp3,రుణ తిరిగి చెల్లించింది. మీ సకాలంలో చెల్లింపులకు ధన్యవాదాలు.,../data/te/te_voicedata/83.mp3,قرض کی ادائیگی. آپ کی بروقت ادائیگیوں کا شکریہ۔,../data/ur/ur_voicedata/83.mp3,ঋণ পৰিশোধ কৰা হৈছে। আপোনাৰ সময়োপযোগী পেমেণ্টৰ বাবে ধন্যবাদ।,../data/as/as_voicedata/83.mp3,Loan ଣ ପରିଶୋଧ ତୁମର ସମୟାନୁବର୍ତ୍ତୀ ଦେୟ ପାଇଁ ଧନ୍ୟବାଦ |,../data/or/or_voicedata/83.mp3
উদ্বৃত্ত শোধ করা। আপনি প্রয়োজনের চেয়ে বেশি অর্থ প্রদান করেছেন।,../data/bn/bn_voicedata/84.mp3,Surplus repaid. You have paid more than required.,../data/en/en_voicedata/84.mp3,સરપ્લસ ચૂકવવામાં આવે છે. તમે જરૂરી કરતાં વધુ ચૂકવણી કરી છે.,../data/gu/gu_voicedata/84.mp3,अधिशेष भुगतान। आपने आवश्यकता से अधिक भुगतान किया है।,../data/hi/hi_voicedata/84.mp3,ಹೆಚ್ಚುವರಿ ಮರುಪಾವತಿ. ನೀವು ಅಗತ್ಯಕ್ಕಿಂತ ಹೆಚ್ಚಿನದನ್ನು ಪಾವತಿಸಿದ್ದೀರಿ.,../data/kn/kn_voicedata/84.mp3,മിച്ച തിരിച്ചടച്ചു. ആവശ്യമുള്ളതിനേക്കാൾ കൂടുതൽ നിങ്ങൾ പണം നൽകി.,../data/ml/ml_voicedata/84.mp3,अतिरिक्त परतफेड. आपण आवश्यकतेपेक्षा जास्त पैसे दिले आहेत.,../data/mr/mr_voicedata/84.mp3,உபரி திருப்பிச் செலுத்தப்பட்டது. நீங்கள் தேவையானதை விட அதிகமாக பணம் செலுத்தியுள்ளீர்கள்.,../data/ta/ta_voicedata/84.mp3,మిగులు తిరిగి చెల్లించింది. మీరు అవసరమైన దానికంటే ఎక్కువ చెల్లించారు.,../data/te/te_voicedata/84.mp3,سرپلس کی ادائیگی آپ نے ضرورت سے زیادہ ادائیگی کی ہے۔,../data/ur/ur_voicedata/84.mp3,উদ্বৃত্ত repaid. আপুনি প্ৰয়োজনতকৈ বেছি ধন দিছে।,../data/as/as_voicedata/84.mp3,ସରପ୍ଲସ୍ ପରିଶୋଧ ଆପଣ ଆବଶ୍ୟକଠାରୁ ଅଧିକ ଦେୟ ଦେଇଛନ୍ତି |,../data/or/or_voicedata/84.mp3
পুনর্গঠন ব্যবহারকারী যাচাইকরণ সম্পন্ন হয়েছে। Nder ণদানকারী অনুমোদনের অপেক্ষায়।,../data/bn/bn_voicedata/85.mp3,Restructure user verification completed. Awaiting lender approval.,../data/en/en_voicedata/85.mp3,પુનર્ગઠન વપરાશકર્તા ચકાસણી પૂર્ણ. Nder ણદાતાની મંજૂરીની રાહ જોવી.,../data/gu/gu_voicedata/85.mp3,पुनर्गठन उपयोगकर्ता सत्यापन पूरा हुआ। ऋणदाता अनुमोदन का इंतजार है।,../data/hi/hi_voicedata/85.mp3,ಬಳಕೆದಾರರ ಪರಿಶೀಲನೆ ಪೂರ್ಣಗೊಂಡಿದೆ. ಸಾಲದಾತರ ಅನುಮೋದನೆಗಾಗಿ ಕಾಯುತ್ತಿದೆ.,../data/kn/kn_voicedata/85.mp3,പുന ructure ക്രമീകരിച്ച ഉപയോക്തൃ സ്ഥിരീകരണം പൂർത്തിയായി. കടം കൊടുക്കുന്ന അംഗീകാരത്തിനായി കാത്തിരിക്കുന്നു.,../data/ml/ml_voicedata/85.mp3,पुनर्रचना वापरकर्ता सत्यापन पूर्ण. सावकाराच्या मंजुरीची वाट पहात आहे.,../data/mr/mr_voicedata/85.mp3,பயனர் சரிபார்ப்பை மறுசீரமைத்தல் முடிந்தது. கடன் வழங்குபவரின் ஒப்புதலுக்காக காத்திருக்கிறது.,../data/ta/ta_voicedata/85.mp3,పునర్నిర్మాణం వినియోగదారు ధృవీకరణ పూర్తయింది. రుణదాత ఆమోదం కోసం వేచి ఉంది.,../data/te/te_voicedata/85.mp3,تنظیم نو صارف کی توثیق مکمل ہوگئی۔ قرض دینے والے کی منظوری کے منتظر,../data/ur/ur_voicedata/85.mp3,পুনৰ্গঠন ব্যৱহাৰকাৰী পৰীক্ষণ সম্পূৰ্ণ কৰা হৈছে। ঋণদাতাৰ অনুমোদনৰ বাবে অপেক্ষা কৰি আছে।,../data/as/as_voicedata/85.mp3,ସ୍କ୍ରିନସାଳା ବ୍ୟବହାରକାରୀ ଯାଞ୍ଚ ସମାପ୍ତ ହୋଇଛି | Ender ଣ ଅନୁମୋଦନକୁ ଅପେକ୍ଷା କରିଛି |,../data/or/or_voicedata/85.mp3
Nder ণদানকারী অনুমোদিত পুনর্গঠন। ট্র্যাঞ্চে বিতরণ পরবর্তী।,../data/bn/bn_voicedata/86.mp3,Lender approved restructure. Tranche disbursal next.,../data/en/en_voicedata/86.mp3,Le ણદાતા માન્ય પુનર્ગઠન. આગળના ભાગનું વિતરણ.,../data/gu/gu_voicedata/86.mp3,ऋणदाता ने पुनर्गठन को मंजूरी दी। Tranche Disbursal अगला।,../data/hi/hi_voicedata/86.mp3,ಸಾಲದಾತನು ಪುನರ್ರಚನೆಯನ್ನು ಅನುಮೋದಿಸಿದನು. ಟ್ರಾಂಚೆ ಮುಂದೆ ವಿತರಣೆ.,../data/kn/kn_voicedata/86.mp3,കടം കൊടുക്കുന്നയാൾ അംഗീകരിച്ചു. ട്രാൻജ് അടുത്തതായി.,../data/ml/ml_voicedata/86.mp3,सावकार मंजूर पुनर्रचना. पुढे ट्रॅन्च डिस्क्रिझल.,../data/mr/mr_voicedata/86.mp3,கடன் வழங்குபவர் அங்கீகரிக்கப்பட்ட மறுசீரமைப்பு. அடுத்தது.,../data/ta/ta_voicedata/86.mp3,రుణదాత ఆమోదించబడిన పునర్నిర్మాణం. ట్రాన్చే పంపిణీ తరువాత.,../data/te/te_voicedata/86.mp3,قرض دینے والے نے تنظیم نو کی منظوری دی۔ اگلے دن,../data/ur/ur_voicedata/86.mp3,ঋণদাতাই পুনৰ্গঠনত অনুমোদন জনায়। ট্ৰেঞ্চ বিতৰণ পৰৱৰ্তী।,../data/as/as_voicedata/86.mp3,Ender ଣଦାତା ଅନୁମୋଦିତ ପୁନରାବୃତ୍ତି | ପରବର୍ତ୍ତୀ ସମୟରେ ଟ୍ରାନଚେ ଭିନ୍ନ |,../data/or/or_voicedata/86.mp3
