bn_sentence,bn_voice,en_sentence,en_voice,gu_sentence,gu_voice,hi_sentence,hi_voice,kn_sentence,kn_voice,ml_sentence,ml_voice,mr_sentence,mr_voice,ta_sentence,ta_voice,te_sentence,te_voice,ur_sentence,ur_voice,as_sentence,as_voice,or_sentence,or_voice
আমরা আরও প্রক্রিয়াজাতকরণের জন্য আপনার ব্যবহারকারীর প্রোফাইলটি পরীক্ষা করছি।,../data/bn/bn_voicedata/26.mp3,We are checking on your user profile for further processing.,../data/en/en_voicedata/26.mp3,અમે આગળની પ્રક્રિયા માટે તમારી વપરાશકર્તા પ્રોફાઇલ પર તપાસ કરી રહ્યા છીએ.,../data/gu/gu_voicedata/26.mp3,हम आगे की प्रक्रिया के लिए आपके उपयोगकर्ता प्रोफ़ाइल पर जाँच कर रहे हैं।,../data/hi/hi_voicedata/26.mp3,ಹೆಚ್ಚಿನ ಪ್ರಕ್ರಿಯೆಗಾಗಿ ನಾವು ನಿಮ್ಮ ಬಳಕೆದಾರರ ಪ್ರೊಫೈಲ್ ಅನ್ನು ಪರಿಶೀಲಿಸುತ್ತಿದ್ದೇವೆ.,../data/kn/kn_voicedata/26.mp3,കൂടുതൽ പ്രോസസ്സിംഗിനായി ഞങ്ങൾ നിങ്ങളുടെ ഉപയോക്തൃ പ്രൊഫൈൽ പരിശോധിക്കുന്നു.,../data/ml/ml_voicedata/26.mp3,आम्ही पुढील प्रक्रियेसाठी आपल्या वापरकर्त्याच्या प्रोफाइलवर तपासणी करीत आहोत.,../data/mr/mr_voicedata/26.mp3,மேலும் செயலாக்க உங்கள் பயனர் சுயவிவரத்தை நாங்கள் சரிபார்க்கிறோம்.,../data/ta/ta_voicedata/26.mp3,మరింత ప్రాసెసింగ్ కోసం మేము మీ వినియోగదారు ప్రొఫైల్‌ను తనిఖీ చేస్తున్నాము.,../data/te/te_voicedata/26.mp3,ہم مزید پروسیسنگ کے ل your آپ کے صارف پروفائل کی جانچ کر رہے ہیں۔,../data/ur/ur_voicedata/26.mp3,আমি আপোনাৰ ব্যৱহাৰকাৰী প্ৰ'ফাইলত অধিক প্ৰক্ৰিয়াকৰণৰ বাবে পৰীক্ষা কৰি আছো।,../data/as/as_voicedata/26.mp3,ପରବର୍ତ୍ତୀ ପ୍ରକ୍ରିୟାକରଣ ପାଇଁ ଆମେ ଆପଣଙ୍କର ଉପଭୋକ୍ତା ପ୍ରୋଫାଇଲ୍ ଉପରେ ଯାଞ୍ଚ କରୁଛୁ |,../data/or/or_voicedata/26.mp3
আপনার loan ণ বর্তমানে স্থগিতের অধীনে রয়েছে।,../data/bn/bn_voicedata/27.mp3,Your loan is currently under moratorium.,../data/en/en_voicedata/27.mp3,તમારી લોન હાલમાં મોરટોરિયમ હેઠળ છે.,../data/gu/gu_voicedata/27.mp3,आपका ऋण वर्तमान में अधिस्थगन के अधीन है।,../data/hi/hi_voicedata/27.mp3,ನಿಮ್ಮ ಸಾಲವು ಪ್ರಸ್ತುತ ನಿಷೇಧದಲ್ಲಿದೆ.,../data/kn/kn_voicedata/27.mp3,നിങ്ങളുടെ വായ്പ നിലവിൽ മൊറട്ടോറിയത്തിലാണ്.,../data/ml/ml_voicedata/27.mp3,आपले कर्ज सध्या स्थगिती अंतर्गत आहे.,../data/mr/mr_voicedata/27.mp3,உங்கள் கடன் தற்போது தடைக்காலத்தின் கீழ் உள்ளது.,../data/ta/ta_voicedata/27.mp3,మీ loan ణం ప్రస్తుతం తాత్కాలిక నిషేధంలో ఉంది.,../data/te/te_voicedata/27.mp3,آپ کا قرض فی الحال مورٹوریم کے تحت ہے۔,../data/ur/ur_voicedata/27.mp3,আপোনাৰ ঋণ বৰ্তমান মৰেটৰিয়ামৰ অধীনত আছে।,../data/as/as_voicedata/27.mp3,ତୁମର loan ଣ ବର୍ତ୍ତମାନ ମୋରାଟୋଟ୍ରିମିୟମ ଅଧୀନରେ ଅଛି |,../data/or/or_voicedata/27.mp3
আপনার loan ণের ম্যানুয়াল বিতরণ শুরু করা হয়েছে।,../data/bn/bn_voicedata/28.mp3,Manual disbursal of your loan has been initiated.,../data/en/en_voicedata/28.mp3,તમારી લોનનું મેન્યુઅલ વિતરણ શરૂ કરવામાં આવ્યું છે.,../data/gu/gu_voicedata/28.mp3,आपके ऋण का मैनुअल डिस्बर्सल शुरू किया गया है।,../data/hi/hi_voicedata/28.mp3,ನಿಮ್ಮ ಸಾಲದ ಹಸ್ತಚಾಲಿತ ವಿತರಣೆಯನ್ನು ಪ್ರಾರಂಭಿಸಲಾಗಿದೆ.,../data/kn/kn_voicedata/28.mp3,നിങ്ങളുടെ വായ്പയുടെ സ്വമേധയാലുള്ള വിതരണം ആരംഭിച്ചു.,../data/ml/ml_voicedata/28.mp3,आपल्या कर्जाचे मॅन्युअल वितरण सुरू केले गेले आहे.,../data/mr/mr_voicedata/28.mp3,உங்கள் கடனை கையேடு வழங்குவது தொடங்கப்பட்டது.,../data/ta/ta_voicedata/28.mp3,మీ loan ణం యొక్క మాన్యువల్ పంపిణీ ప్రారంభించబడింది.,../data/te/te_voicedata/28.mp3,آپ کے قرض کی دستی تقسیم شروع کردی گئی ہے۔,../data/ur/ur_voicedata/28.mp3,আপোনাৰ ঋণৰ হাতৰ দ্বাৰা বিতৰণ কৰা হৈছে।,../data/as/as_voicedata/28.mp3,ତୁମର loan ଣର ମାନୁଆଲ ବଣ୍ଟନ ଆରମ୍ଭ ହୋଇଛି |,../data/or/or_voicedata/28.mp3
আপনার loan ণ বর্তমান স্থিতিতে রয়েছে। কোনও পদক্ষেপের প্রয়োজন নেই।,../data/bn/bn_voicedata/29.mp3,Your loan is in current status. No action required.,../data/en/en_voicedata/29.mp3,તમારી લોન વર્તમાન સ્થિતિમાં છે. કોઈ ક્રિયા જરૂરી નથી.,../data/gu/gu_voicedata/29.mp3,आपका ऋण वर्तमान स्थिति में है। कोई कार्रवाई की आवश्यकता नहीं है।,../data/hi/hi_voicedata/29.mp3,ನಿಮ್ಮ ಸಾಲವು ಪ್ರಸ್ತುತ ಸ್ಥಿತಿಯಲ್ಲಿದೆ. ಯಾವುದೇ ಕ್ರಮ ಅಗತ್ಯವಿಲ್ಲ.,../data/kn/kn_voicedata/29.mp3,നിങ്ങളുടെ വായ്പ നിലവിലെ നിലയിലാണ്. പ്രവർത്തനമൊന്നും ആവശ്യമില്ല.,../data/ml/ml_voicedata/29.mp3,आपले कर्ज सध्याच्या स्थितीत आहे. कोणतीही कारवाई आवश्यक नाही.,../data/mr/mr_voicedata/29.mp3,உங்கள் கடன் தற்போதைய நிலையில் உள்ளது. எந்த நடவடிக்கையும் தேவையில்லை.,../data/ta/ta_voicedata/29.mp3,మీ loan ణం ప్రస్తుత స్థితిలో ఉంది. చర్య అవసరం లేదు.,../data/te/te_voicedata/29.mp3,آپ کا قرض موجودہ حیثیت میں ہے۔ کسی کارروائی کی ضرورت نہیں ہے۔,../data/ur/ur_voicedata/29.mp3,আপোনাৰ ঋণ বৰ্তমানৰ অৱস্থাত আছে। কোনো ব্যৱস্থা লোৱাৰ প্ৰয়োজন নাই।,../data/as/as_voicedata/29.mp3,ତୁମର loan ଣ ବର୍ତ୍ତମାନର ସ୍ଥିତିରେ ଅଛି | କ action ଣସି କାର୍ଯ୍ୟ ଆବଶ୍ୟକ ନାହିଁ |,../data/or/or_voicedata/29.mp3
আপনার loan ণ পরিশোধ দেরি হয়েছে। যত তাড়াতাড়ি সম্ভব অর্থ প্রদান করুন।,../data/bn/bn_voicedata/30.mp3,Your loan repayment is late. Please pay as soon as possible.,../data/en/en_voicedata/30.mp3,[Translation error: Your loan repayment is late. Please pay as soon as possible. --> No translation was found using the current translator. Try another translator?],../data/gu/gu_voicedata/30.mp3,आपका ऋण चुकौती देर हो चुकी है। कृपया जल्द से जल्द भुगतान करें।,../data/hi/hi_voicedata/30.mp3,ನಿಮ್ಮ ಸಾಲ ಮರುಪಾವತಿ ತಡವಾಗಿದೆ. ದಯವಿಟ್ಟು ಸಾಧ್ಯವಾದಷ್ಟು ಬೇಗ ಪಾವತಿಸಿ.,../data/kn/kn_voicedata/30.mp3,നിങ്ങളുടെ വായ്പ തിരിച്ചടവ് വൈകി. കഴിയുന്നതും വേഗം അടയ്ക്കുക.,../data/ml/ml_voicedata/30.mp3,आपल्या कर्जाची परतफेड उशीरा आहे. कृपया शक्य तितक्या लवकर पैसे द्या.,../data/mr/mr_voicedata/30.mp3,உங்கள் கடன் திருப்பிச் செலுத்துதல் தாமதமானது. தயவுசெய்து விரைவில் செலுத்துங்கள்.,../data/ta/ta_voicedata/30.mp3,మీ రుణ తిరిగి చెల్లించడం ఆలస్యం. దయచేసి వీలైనంత త్వరగా చెల్లించండి.,../data/te/te_voicedata/30.mp3,آپ کے قرض کی ادائیگی میں دیر ہوچکی ہے۔ براہ کرم جلد از جلد ادائیگی کریں۔,../data/ur/ur_voicedata/30.mp3,আপোনাৰ ঋণ পৰিশোধ পলম হৈছে। অনুগ্ৰহ কৰি যিমান পাৰি সোনকালে ধন দিব লাগে।,../data/as/as_voicedata/30.mp3,ତୁମର loan ଣ ପରିଶୋଧ ବିଳମ୍ବ ହୋଇଛି | ଦୟାକରି ଯଥାଶୀଘ୍ର ଦେୟ ଦିଅ |,../data/or/or_voicedata/30.mp3
আপনার loan ণ এনপিএ 30 হিসাবে শ্রেণিবদ্ধ করা হয়েছে। তাত্ক্ষণিক পদক্ষেপের প্রয়োজন।,../data/bn/bn_voicedata/31.mp3,Your loan is classified as NPA 30. Immediate action required.,../data/en/en_voicedata/31.mp3,તમારી લોનને એનપીએ 30 તરીકે વર્ગીકૃત કરવામાં આવી છે. તાત્કાલિક કાર્યવાહી જરૂરી છે.,../data/gu/gu_voicedata/31.mp3,आपके ऋण को एनपीए 30 के रूप में वर्गीकृत किया गया है। तत्काल कार्रवाई की आवश्यकता है।,../data/hi/hi_voicedata/31.mp3,ನಿಮ್ಮ ಸಾಲವನ್ನು ಎನ್‌ಪಿಎ 30 ಎಂದು ವರ್ಗೀಕರಿಸಲಾಗಿದೆ. ತಕ್ಷಣದ ಕ್ರಮ ಅಗತ್ಯವಿದೆ.,../data/kn/kn_voicedata/31.mp3,നിങ്ങളുടെ വായ്പ NPA 30 ആയി തരംതിരിക്കുന്നു. ഉടനടി നടപടി ആവശ്യമാണ്.,../data/ml/ml_voicedata/31.mp3,आपले कर्ज एनपीए 30 म्हणून वर्गीकृत केले आहे. त्वरित कारवाई आवश्यक आहे.,../data/mr/mr_voicedata/31.mp3,உங்கள் கடன் NPA 30 என வகைப்படுத்தப்பட்டுள்ளது. உடனடி நடவடிக்கை தேவை.,../data/ta/ta_voicedata/31.mp3,మీ loan ణం NPA 30 గా వర్గీకరించబడింది. తక్షణ చర్య అవసరం.,../data/te/te_voicedata/31.mp3,آپ کے قرض کو NPA 30 کے طور پر درجہ بندی کیا گیا ہے۔ فوری کارروائی کی ضرورت ہے۔,../data/ur/ur_voicedata/31.mp3,আপোনাৰ ঋণ NPA 30 হিচাপে শ্ৰেণীভুক্ত কৰা হৈছে।,../data/as/as_voicedata/31.mp3,ତୁମର loan ଣ NPA 30 ଭାବରେ ଶ୍ରେଣୀଭୁକ୍ତ ହୋଇଛି | ତୁରନ୍ତ କାର୍ଯ୍ୟ ଆବଶ୍ୟକ |,../data/or/or_voicedata/31.mp3
আপনার loan ণ এনপিএ 60 হিসাবে শ্রেণিবদ্ধ করা হয়েছে। দয়া করে সমর্থনের সাথে যোগাযোগ করুন।,../data/bn/bn_voicedata/32.mp3,Your loan is classified as NPA 60. Please contact support.,../data/en/en_voicedata/32.mp3,તમારી લોનને એનપીએ 60 તરીકે વર્ગીકૃત કરવામાં આવી છે. કૃપા કરીને સપોર્ટનો સંપર્ક કરો.,../data/gu/gu_voicedata/32.mp3,आपके ऋण को NPA 60 के रूप में वर्गीकृत किया गया है। कृपया समर्थन संपर्क करें।,../data/hi/hi_voicedata/32.mp3,ನಿಮ್ಮ ಸಾಲವನ್ನು ಎನ್‌ಪಿಎ 60 ಎಂದು ವರ್ಗೀಕರಿಸಲಾಗಿದೆ. ದಯವಿಟ್ಟು ಬೆಂಬಲವನ್ನು ಸಂಪರ್ಕಿಸಿ.,../data/kn/kn_voicedata/32.mp3,നിങ്ങളുടെ വായ്പ എൻപിഎ 60 ആയി തരം തിരിച്ചിരിക്കുന്നു. പിന്തുണയുമായി ബന്ധപ്പെടുക.,../data/ml/ml_voicedata/32.mp3,आपले कर्ज एनपीए 60 म्हणून वर्गीकृत केले आहे. कृपया समर्थनाशी संपर्क साधा.,../data/mr/mr_voicedata/32.mp3,உங்கள் கடன் NPA 60 என வகைப்படுத்தப்பட்டுள்ளது. தயவுசெய்து ஆதரவைத் தொடர்பு கொள்ளவும்.,../data/ta/ta_voicedata/32.mp3,మీ loan ణం NPA 60 గా వర్గీకరించబడింది. దయచేసి మద్దతును సంప్రదించండి.,../data/te/te_voicedata/32.mp3,آپ کے قرض کو NPA 60 کے طور پر درجہ بندی کیا گیا ہے۔ براہ کرم مدد سے رابطہ کریں۔,../data/ur/ur_voicedata/32.mp3,আপোনাৰ ঋণ NPA 60 হিচাপে শ্ৰেণীভুক্ত কৰা হৈছে। অনুগ্ৰহ কৰি সমৰ্থনৰ সৈতে যোগাযোগ কৰক।,../data/as/as_voicedata/32.mp3,ଆପଣଙ୍କର loan ଣ npa 60 ଭାବରେ ଶ୍ରେଣୀଭୁକ୍ତ ହୋଇଛି | ଦୟାକରି ସମର୍ଥନ ଯୋଗାଯୋଗ କରନ୍ତୁ |,../data/or/or_voicedata/32.mp3
আপনার loan ণ এনপিএ 90 হিসাবে শ্রেণিবদ্ধ করা হয়েছে। আইনী পদক্ষেপ শুরু করা যেতে পারে।,../data/bn/bn_voicedata/33.mp3,Your loan is classified as NPA 90. Legal action may be initiated.,../data/en/en_voicedata/33.mp3,તમારી લોનને એનપીએ 90 તરીકે વર્ગીકૃત કરવામાં આવી છે. કાનૂની કાર્યવાહી શરૂ કરી શકાય છે.,../data/gu/gu_voicedata/33.mp3,आपके ऋण को एनपीए 90 के रूप में वर्गीकृत किया गया है। कानूनी कार्रवाई शुरू की जा सकती है।,../data/hi/hi_voicedata/33.mp3,ನಿಮ್ಮ ಸಾಲವನ್ನು ಎನ್‌ಪಿಎ 90 ಎಂದು ವರ್ಗೀಕರಿಸಲಾಗಿದೆ. ಕಾನೂನು ಕ್ರಮವನ್ನು ಪ್ರಾರಂಭಿಸಬಹುದು.,../data/kn/kn_voicedata/33.mp3,നിങ്ങളുടെ വായ്പ NPA 90 ആയി തരംതിരിക്കുന്നു. നിയമ നടപടികൾ ആരംഭിക്കാം.,../data/ml/ml_voicedata/33.mp3,आपले कर्ज एनपीए 90 म्हणून वर्गीकृत केले आहे. कायदेशीर कारवाई सुरू केली जाऊ शकते.,../data/mr/mr_voicedata/33.mp3,உங்கள் கடன் NPA 90 என வகைப்படுத்தப்பட்டுள்ளது. சட்ட நடவடிக்கை தொடங்கப்படலாம்.,../data/ta/ta_voicedata/33.mp3,మీ loan ణం NPA 90 గా వర్గీకరించబడింది. చట్టపరమైన చర్యలు ప్రారంభించవచ్చు.,../data/te/te_voicedata/33.mp3,آپ کے قرض کو NPA 90 کے طور پر درجہ بندی کیا گیا ہے۔ قانونی کارروائی شروع کی جاسکتی ہے۔,../data/ur/ur_voicedata/33.mp3,আপোনাৰ ঋণক NPA 90 হিচাপে শ্ৰেণীভুক্ত কৰা হয়।আইনী ব্যৱস্থা আৰম্ভ কৰিব পাৰি।,../data/as/as_voicedata/33.mp3,ତୁମର loan ଣ NPA 90 ଭାବରେ ଶ୍ରେଣୀଭୁକ୍ତ ହୋଇଛି | ଆଇନଗତ କାର୍ଯ୍ୟ ଆରମ୍ଭ ହୋଇପାରେ |,../data/or/or_voicedata/33.mp3
আপনার loan ণ অ্যাকাউন্টের জন্য এজেন্ট হস্তক্ষেপ প্রয়োজন।,../data/bn/bn_voicedata/34.mp3,Agent intervention is required for your loan account.,../data/en/en_voicedata/34.mp3,તમારા લોન એકાઉન્ટ માટે એજન્ટ હસ્તક્ષેપ જરૂરી છે.,../data/gu/gu_voicedata/34.mp3,आपके ऋण खाते के लिए एजेंट हस्तक्षेप की आवश्यकता है।,../data/hi/hi_voicedata/34.mp3,ನಿಮ್ಮ ಸಾಲ ಖಾತೆಗೆ ಏಜೆಂಟ್ ಹಸ್ತಕ್ಷೇಪದ ಅಗತ್ಯವಿದೆ.,../data/kn/kn_voicedata/34.mp3,നിങ്ങളുടെ വായ്പാ അക്കൗണ്ടിനായി ഏജന്റ് ഇടപെടൽ ആവശ്യമാണ്.,../data/ml/ml_voicedata/34.mp3,आपल्या कर्ज खात्यासाठी एजंटचा हस्तक्षेप आवश्यक आहे.,../data/mr/mr_voicedata/34.mp3,உங்கள் கடன் கணக்கிற்கு முகவர் தலையீடு தேவை.,../data/ta/ta_voicedata/34.mp3,మీ రుణ ఖాతాకు ఏజెంట్ జోక్యం అవసరం.,../data/te/te_voicedata/34.mp3,آپ کے لون اکاؤنٹ کے لئے ایجنٹ کی مداخلت ضروری ہے۔,../data/ur/ur_voicedata/34.mp3,আপোনাৰ ঋণ একাউণ্টৰ বাবে এজেণ্টৰ হস্তক্ষেপৰ প্ৰয়োজন।,../data/as/as_voicedata/34.mp3,ଆପଣଙ୍କର loan ଣ ଖାତା ପାଇଁ ଏଜେଣ୍ଟ ହସ୍ତକ୍ଷେପ ଆବଶ୍ୟକ |,../data/or/or_voicedata/34.mp3
আপনার loan ণ অ্যাকাউন্টের জন্য অংশীদার হস্তক্ষেপ প্রয়োজন।,../data/bn/bn_voicedata/35.mp3,Partner intervention is required for your loan account.,../data/en/en_voicedata/35.mp3,તમારા લોન એકાઉન્ટ માટે ભાગીદારની હસ્તક્ષેપ જરૂરી છે.,../data/gu/gu_voicedata/35.mp3,आपके ऋण खाते के लिए भागीदार हस्तक्षेप की आवश्यकता है।,../data/hi/hi_voicedata/35.mp3,ನಿಮ್ಮ ಸಾಲ ಖಾತೆಗೆ ಪಾಲುದಾರರ ಹಸ್ತಕ್ಷೇಪದ ಅಗತ್ಯವಿದೆ.,../data/kn/kn_voicedata/35.mp3,പങ്കാളി അക്കൗണ്ടിനായി പങ്കാളിയുടെ ഇടപെടൽ ആവശ്യമാണ്.,../data/ml/ml_voicedata/35.mp3,आपल्या कर्ज खात्यासाठी भागीदार हस्तक्षेप आवश्यक आहे.,../data/mr/mr_voicedata/35.mp3,உங்கள் கடன் கணக்கிற்கு கூட்டாளர் தலையீடு தேவை.,../data/ta/ta_voicedata/35.mp3,మీ రుణ ఖాతాకు భాగస్వామి జోక్యం అవసరం.,../data/te/te_voicedata/35.mp3,آپ کے لون اکاؤنٹ کے لئے پارٹنر مداخلت کی ضرورت ہے۔,../data/ur/ur_voicedata/35.mp3,আপোনাৰ ঋণ একাউণ্টৰ বাবে অংশীদাৰৰ হস্তক্ষেপৰ প্ৰয়োজন।,../data/as/as_voicedata/35.mp3,ଆପଣଙ୍କ loan ଣ ଖାତା ପାଇଁ ସହଭାଗୀ ହସ୍ତକ୍ଷେପ ଆବଶ୍ୟକ |,../data/or/or_voicedata/35.mp3
আপনার loan ণ অ্যাকাউন্টের জন্য nder ণদানকারী হস্তক্ষেপ প্রয়োজন।,../data/bn/bn_voicedata/36.mp3,Lender intervention is required for your loan account.,../data/en/en_voicedata/36.mp3,તમારા લોન એકાઉન્ટ માટે nder ણદાતા હસ્તક્ષેપ જરૂરી છે.,../data/gu/gu_voicedata/36.mp3,आपके ऋण खाते के लिए ऋणदाता हस्तक्षेप आवश्यक है।,../data/hi/hi_voicedata/36.mp3,ನಿಮ್ಮ ಸಾಲ ಖಾತೆಗೆ ಸಾಲದಾತ ಹಸ್ತಕ್ಷೇಪದ ಅಗತ್ಯವಿದೆ.,../data/kn/kn_voicedata/36.mp3,നിങ്ങളുടെ വായ്പാ അക്കൗണ്ടിനായി വായ്പ നൽകുന്ന ഇടപെടൽ ആവശ്യമാണ്.,../data/ml/ml_voicedata/36.mp3,आपल्या कर्जाच्या खात्यासाठी सावकार हस्तक्षेप आवश्यक आहे.,../data/mr/mr_voicedata/36.mp3,உங்கள் கடன் கணக்கிற்கு கடன் வழங்குநர் தலையீடு தேவை.,../data/ta/ta_voicedata/36.mp3,మీ రుణ ఖాతాకు రుణదాత జోక్యం అవసరం.,../data/te/te_voicedata/36.mp3,آپ کے لون اکاؤنٹ کے لئے قرض دینے والے مداخلت کی ضرورت ہے۔,../data/ur/ur_voicedata/36.mp3,আপোনাৰ ঋণ একাউণ্টৰ বাবে ঋণদাতাৰ হস্তক্ষেপৰ প্ৰয়োজন।,../data/as/as_voicedata/36.mp3,ତୁମର loan ଣ ଖାତା ପାଇଁ ender ଣଦାତା ହସ୍ତକ୍ଷେପ ଆବଶ୍ୟକ |,../data/or/or_voicedata/36.mp3
আপনার অ্যাকাউন্টে উদ্বৃত্ত এক ay ণ পরিশোধ রয়েছে।,../data/bn/bn_voicedata/37.mp3,Your account has surplus one repayment.,../data/en/en_voicedata/37.mp3,તમારા ખાતામાં એક ચુકવણી સરપ્લસ છે.,../data/gu/gu_voicedata/37.mp3,आपके खाते में अधिशेष एक चुकौती है।,../data/hi/hi_voicedata/37.mp3,ನಿಮ್ಮ ಖಾತೆಯು ಹೆಚ್ಚುವರಿ ಮರುಪಾವತಿಯನ್ನು ಹೊಂದಿದೆ.,../data/kn/kn_voicedata/37.mp3,നിങ്ങളുടെ അക്കൗണ്ടിന് മിച്ചം ഒരു തിരിച്ചടവ് ഉണ്ട്.,../data/ml/ml_voicedata/37.mp3,आपल्या खात्यात अतिरिक्त परतफेड आहे.,../data/mr/mr_voicedata/37.mp3,உங்கள் கணக்கில் உபரி ஒரு திருப்பிச் செலுத்துதல் உள்ளது.,../data/ta/ta_voicedata/37.mp3,మీ ఖాతాకు మిగులు ఒక తిరిగి చెల్లిస్తుంది.,../data/te/te_voicedata/37.mp3,آپ کے اکاؤنٹ میں اضافی ادائیگی ہے۔,../data/ur/ur_voicedata/37.mp3,আপোনাৰ একাউণ্টত উদ্বৃত্ত এটা পৰিশোধ আছে।,../data/as/as_voicedata/37.mp3,ତୁମର ଆକାଉଣ୍ଟରେ ଏକର ପରିଶୋଧ ଅଛି |,../data/or/or_voicedata/37.mp3
